{
  "version": "1.1",
  "run_id": "20260730T142300Z-9f2c1ab4",
  "round": 1,
  "created_at": "2026-07-30T14:41:00Z",
  "shot_id": "shot_01",
  "brand_lock_ref": "brand-lock.snapshot.md",
  "brand_lock_sha256": "11e3525c5dcdd646f16503acbcb7015e8f4a77b8d80ea64ba8bbacadb69178c3",
  "image_ref": "frames/round-1/shot_01.png",
  "image_sha256": "7c93763a04dacf1258cf8605cc6f3af45f0f7069f6fefe9bff2a14c0a779bd3d",
  "prompt_ref": "prompts/round-1/flux.txt",
  "prompt_sha256": "a0203e0c49cafd75d8fcb86997ba619c5ac82700dc4ab430812a9929aca89328",
  "generator": "flux",
  "model_version": "2 Pro",
  "seed": 481207,
  "verdict": "ACCEPT",
  "confidence": "HIGH",
  "working": [
    "Framing matches the spec: MCU, eye level, subject held frame-left with the right two-thirds open.",
    "Character matches the series_lock anchor verbatim: salt-and-pepper hair, navy crewneck.",
    "Lighting reads window-left, warm afternoon, as specified.",
    "Hands, eyes, and skin texture are clean."
  ],
  "issues": [
    {
      "layer": "Technical",
      "severity": "minor",
      "note": "Grade sits a touch cool against the warm-afternoon spec.",
      "fix_type": "post-level",
      "fix": "Push warmth +5 in the grade. No re-generation needed."
    }
  ]
}
