{
  "version": "1.1",
  "run_id": "20260730T142300Z-9f2c1ab4",
  "round": 2,
  "created_at": "2026-07-30T15:19:00Z",
  "shot_id": "shot_02",
  "brand_lock_ref": "brand-lock.snapshot.md",
  "brand_lock_sha256": "11e3525c5dcdd646f16503acbcb7015e8f4a77b8d80ea64ba8bbacadb69178c3",
  "image_ref": "frames/round-2/shot_02.png",
  "image_sha256": "168ccb9e622e99e48a2a13f05a982ef906a32f4eee5a79974913f555789c6296",
  "prompt_ref": "prompts/round-2/revised-flux.txt",
  "prompt_sha256": "f9a807549ff558950dd8a01b8525f89f7e4d480e43d28273ec0182249de83cd7",
  "generator": "flux",
  "model_version": "2 Pro",
  "seed": 481207,
  "verdict": "ACCEPT",
  "confidence": "HIGH",
  "working": [
    "Reframed to MCU; the subject now carries the payoff beat.",
    "Hands are anatomically correct in this sample.",
    "Character, environment, and lighting still match the series_lock anchors."
  ],
  "issues": []
}
